id	title	question	answer	response_question	response_answer	statement
56ce304daab44d1400b8850e	New_York_City	What city in the United States has the highest population?	New York	What city in the United States has the highest population?	new york	new york city has the highest population in the united states
56ce304daab44d1400b8850f	New_York_City	In what city is the United Nations based?	New York	in what city is the united nations based?	new york	the united nations is based in New York
56ce304daab44d1400b88510	New_York_City	What city has been called the cultural capital of the world?	New York	what city has been called the cultural capital of the world?	new york	new york has been called the cultural capital of the world
56ce304daab44d1400b88511	New_York_City	What American city welcomes the largest number of legal immigrants?	New York	What American city welcomes the largest number of legal immigrants?	new york	new york welcomes the largest number of legal immigrants
56cf5d41aab44d1400b89130	New_York_City	The major gateway for immigration has been which US city?	New York City	the major gateway for immigration has been which US city?	new york city	the major gateway for immigration has been in new york city
56cf5d41aab44d1400b89131	New_York_City	The most populated city in the United States is which city?	New York City	the most populated city in the united states is which city?	new york city	the most populated city in the united states is new york city
56ce3124aab44d1400b8852a	New_York_City	How many boroughs comprise New York City?	five	How many boroughs comprise New York City?	five	New York City comprise -s five borough -s
56ce3124aab44d1400b8852b	New_York_City	In what year were the five boroughs combined into one city?	1898	in what year were the five borough -s combined into one city?	1898	the five borough -s were combined into one city in 1898
56ce3124aab44d1400b8852c	New_York_City	In 2014, what did the census estimate the population of New York City to be?	8,491,079	in what year were the five borough -s combined into one city?	8,491,079	the census estimated the population of New York City to be 8,491,079
56ce3124aab44d1400b8852d	New_York_City	What is the size of New York City in square miles?	305	what is the size of New York City in square miles?	305	New York City is 305 square miles
56ce3124aab44d1400b8852e	New_York_City	What is the population of New York's Combined Statistical Area?	23.6 million	what is the population of New York’s Combined Statistical Area?	23.6 million	New York’s Combined Statistical Area has a population of 23.6 million
56cf9d81234ae51400d9be1b	New_York_City	How man boroughs does New York City contain?	five	How man boroughs does New York City contain?	five	New York City contains five borough -s
56cf9d81234ae51400d9be1c	New_York_City	The five boroughs of New York City are named what?	Brooklyn, Queens, Manhattan, the Bronx, and Staten Island	the five boroughs of New York City are named what?	brooklyn, queens, manhattan, the bronx, and staten island	the five borough -s of New York City are named brooklyn, queens, manhattan, the bron
56cf9d81234ae51400d9be1d	New_York_City	All five boroughs of New York City formed into one city on what date?	1898	all five borough -s of New York City formed into one city on what date?	1898	the five borough -s of New York City formed into one city on 1898
56cf9d81234ae51400d9be1e	New_York_City	What is the population of New York City as of 2014?	8,491,079	what is the population of New York City as of 2014?	8,491,079	the population of New York City was 8,491,079 as of 201
56cf9d81234ae51400d9be1f	New_York_City	How many languages are spoken by the people of New York City?	800	how many languages are spoken by the people of New York City?	800	the people of New York City speak 800 languages
56ce31baaab44d1400b8853a	New_York_City	What was the trading post that preceded New York City called?	New Amsterdam	What was the trading post that preceded New York City called?	New Amsterdam	the trading post that preceded New York City was called New Amsterdam
56ce31baaab44d1400b8853b	New_York_City	What nation founded New Amsterdam?	the Dutch Republic	What nation founded New Amsterdam?	the Dutch Republic	the Dutch Republic founded New Amsterdam
56ce31baaab44d1400b8853c	New_York_City	In what year did New York become the largest city in the United States?	1790	in what year did New York become the largest city in the United States?	1790	New York became the largest city in the United States in 1790
56ce31baaab44d1400b8853d	New_York_City	When did the English take over the area from the Dutch?	1664	when did the English take over the area from the Dutch?	1664	the English took over the area from the Dutch in 1664
56ce31baaab44d1400b8853e	New_York_City	In what year did New York cease the be the capital of the United States?	1790	in what year did New York cease the be the capital of the United States?	1790	New York ceased the be the capital of the United States in 1790
56cf9df0234ae51400d9be25	New_York_City	When was New York City established?	1624	When was New York City established?	1624	New York City was established in 1624
56cf9df0234ae51400d9be26	New_York_City	New Amsterdam became the title of New York City in what past date?	1626	New Amsterdam became the title of New York City in what past date?	1626	New Amsterdam became the title of New York City in 1626
56cf9df0234ae51400d9be27	New_York_City	The English occupied New York City beginning on what date?	1664	the English occupied New York City beginning on what date?	1664	the English occupied New York City beginning on date 1664
56cf9df0234ae51400d9be29	New_York_City	New York City is the biggest city in the United States since what historical date?	1790	New York City is the biggest city in the United States since what historical date?	1790	New York City is the biggest city in the United States since 1790
56ce32e7aab44d1400b88550	New_York_City	How many tourists visited New York in 2014?	56 million	how many tourists visited New York in 2014?	56 million	fifty-six million tourists visited New York in 2014
56ce32e7aab44d1400b88551	New_York_City	How many stations are operated by the New York City Subway?	469	how many stations are operated by the New York City Subway?	469	the New York City Subway operates 469 station -s
56ce32e7aab44d1400b88552	New_York_City	In what borough is Wall Street located?	Manhattan	in what borough is Wall Street located?	Manhattan	Wall Street is located in the borough of Manhattan
56cf9f16234ae51400d9be30	New_York_City	How many school and universities are in NYC?	120	how many school and universities are in nyc?	120	there are 120 school -s and universities in nyc
56cf9f16234ae51400d9be31	New_York_City	NYC has the two largest stock exchanges in the world which are called what?	New York Stock Exchange and NASDAQ	NYC has the two largest stock exchanges in the world which are called what?	the new york stock exchange and nasdaq	nyc has the two largest stock exchanges in the world which are called the new york stock exchange and nasdaq
56ce3348aab44d1400b88560	New_York_City	What island was once a part of Long Island?	Staten Island	What island was once a part of Long Island?	staten island	staten island was once a part of long island
56ce3348aab44d1400b88561	New_York_City	During what period was the area around New York City located at the edge of an ice sheet 1,000 feet deep?	the Wisconsinan glaciation	during what period was the area around New York City located at the edge of an ice sheet 1,000 feet deep?	the Wisconsinan glaciation	the area around New York City was located at the edge of an ice sheet
56cf9f4b234ae51400d9be35	New_York_City	Long Island and Staten Island were split in half by what geographical phenomenon?	ice sheet	long island and staten island were split in half by what geographical phenomenon?	ice sheet	long island and staten island were split in half by the ice sheet
56ce33aaaab44d1400b8856a	New_York_City	What was the name of the Lenape homeland?	Lenapehoking	What was the name of the Lenape homeland?	lenapehoking	the lenape homeland was called lenapehoking
56ce345caab44d1400b88580	New_York_City	In what year did the first European arrive in the New York area?	1524	in what year did the first European arrive in the New York area?	1524	the first European arrived in the New York area in 1524
56ce345caab44d1400b88581	New_York_City	What was the name of the first European who arrived in the New York area?	Giovanni da Verrazzano	what was the name of the first European who arrived in the new york area?	Giovanni da Verrazzano	Giovanni da Verrazzano was the first european to arrive in the new york area
56ce345caab44d1400b88582	New_York_City	What was the name of Giovanni da Verrazzano's ship?	La Dauphine	What was the name of Giovanni da Verrazzano's ship?	la dauphine	Giovanni da Verrazzano’s ship was la dauphine
56ce345caab44d1400b88583	New_York_City	What nation did Giovanni da Verrazzano serve?	France	What nation did Giovanni da Verrazzano serve?	france	giovanni da verrazzano served in France
56ce345caab44d1400b88584	New_York_City	What did Giovanni da Verrazzano call the area when he staked claim on it?	Nouvelle Angoulême	what did Giovanni da Verrazzano call the area when he staked claim on it?	nouvelle Angoulême	Giovanni da Verrazzano called the area nouvelle Angoulême
56cfa06a234ae51400d9be39	New_York_City	When was the first European to visit the area of NYC?	1524	when was the first European to visit the area of nyc?	1524	the first European to visit the area of nyc arrived in 1524
56cfa06a234ae51400d9be3a	New_York_City	Giovanni da Verrazzano's ship that sailed to New York was named what?	La Dauphine	Giovanni da Verrazzano's ship that sailed to New York was named what?	la dauphine	the Basilica of the Sacred Heart at Notre Dame is beside to which structure?
56cfa06a234ae51400d9be3b	New_York_City	Giovani da Verrazzano was an explorer from which country?	France	Giovani da Verrazzano was an explorer from which country?	france	giovani da verrazzano was an explorer from the country of france
56ce34c7aab44d1400b88594	New_York_City	In what year did a Spanish expedition visit New York Harbor?	1525	in what year did a Spanish expedition visit New York Harbor?	1525	a Spanish expedition visited New York Harbor in 1525
56ce34c7aab44d1400b88595	New_York_City	Who commanded the Spanish expedition?	Estêvão Gomes	who commanded the Spanish expedition?	estêvão gomes	estêvão gomes commanded the Spanish expedition
56ce34c7aab44d1400b88596	New_York_City	What was the nationality of Estêvão Gomes?	Portuguese	what was the nationality of estêvão gomes?	portuguese	estêvão gomes was of Portuguese nationality
56ce34c7aab44d1400b88597	New_York_City	What monarch did Estêvão Gomes serve?	Charles V	what monarch did estêvão gomes serve?	charles v	estêvão gomes served charles v
56ce34c7aab44d1400b88598	New_York_City	What was the name of Estêvão Gomes's ship?	La Anunciada	what was the name of Estêvão Gomes's ship?	la anunciada	Estêvão Gomes's ship was named la anunciada
56cfa4d8234ae51400d9be3f	New_York_City	The front of the Hudson River was named what by Estevao Gomes?	Rio de San Antonio	the front of the Hudson River was named what by estevao gomes?	rio de san antonio	the front of the Hudson River was named rio de san antonio by estevao gomes
56cfa4d8234ae51400d9be40	New_York_City	What was the first map to show the whole North American East coast?	Padrón Real	what was the first map to show the whole North American East coast?	the padrón real	the padrón real showed the whole North American East coast
56ce3569aab44d1400b885aa	New_York_City	What was the name of the explorer who visited the area in 1609?	Henry Hudson	what was the name of the explorer who visited the area in 1609?	henry hudson	the explorer henry hudson visited the area in 1609
56ce3569aab44d1400b885ab	New_York_City	Who was Henry Hudson working for?	Dutch East India Company	who was henry hudson working for?	Dutch East India Company	henry hudson was working for the Dutch East India Company
56ce3569aab44d1400b885ac	New_York_City	In what year did the Netherlands claim the area between Delaware Bay and Cape Cod?	1614	in what year did the netherlands claim the area between Delaware Bay and Cape Cod?	1614	the netherlands claimed the area between Delaware Bay and Cape Cod in 1614
56ce3569aab44d1400b885ad	New_York_City	How many days did Henry Hudson spend exploring the region?	ten	how many days did henry hudson spend exploring the region?	ten	henry hudson spent ten days exploring the region
56ce3569aab44d1400b885ae	New_York_City	What did Henry Hudson call the river that is now called the Hudson River?	North River	what did Henry Hudson call the river that is now called the Hudson River?	the North River	henry hudson called the river now called the hudson river the North River
56cfab96234ae51400d9be43	New_York_City	Henry Hudson worked for which company in the 1600s?	Dutch East India Company	Henry Hudson worked for which company in the 1600s?	Dutch East India Company	Henry Hudson worked for the Dutch East India Company
56cfab96234ae51400d9be44	New_York_City	In what year was the land between Cape Cod and Delaware Bay claimed by the Dutch?	1614	in what year was the land between Cape Cod and Delaware Bay claimed by the Dutch?	1614	the land between Cape Cod and Delaware Bay was claimed by the Dutch in 1614
56cfab96234ae51400d9be45	New_York_City	Which explorer sailed his ship into New York harbor in 1609?	Henry Hudson	which explorer sailed his ship into New York harbor in 1609?	henry hudson	henry hudson sailed his ship into New York harbor in 1609
56ce362aaab44d1400b885bc	New_York_City	Where was Juan Rodriguez born?	Santo Domingo	where was Juan Rodriguez born?	Santo Domingo	Juan Rodriguez was born in Santo Domingo
56ce362aaab44d1400b885bd	New_York_City	What did the Dutch call Juan Rodriguez?	Jan Rodrigues	what did the Dutch call Juan Rodriguez?	jan rodrigues	the dutch called juan rodriguez jan rodrigues
56ce362aaab44d1400b885be	New_York_City	What was Juan Rodriguez's occupation?	trader	What was Juan Rodriguez's occupation?	trader	juan rodríguez was a trader
56ce362aaab44d1400b885bf	New_York_City	What is the street that is named after Juan Rodriguez?	Juan Rodriguez Way	what is the street that is named after Juan Rodriguez?	juan rodríguez way	the street is named after juan rodríguez way
56ce362aaab44d1400b885c0	New_York_City	During what season did Juan Rodriguez first come to New York?	winter	during what season did juan rodriguez first come to new york?	winter	juan rodriguez first came to new york during the winter season
56cfabed234ae51400d9be49	New_York_City	Who was the first non-Indian person to live in what is now NYC?	Juan Rodriguez	who was the first non-Indian person to live in what is now nyc?	juan rodríguez	juan rodríguez was the first non-indian person to live in what is now nyc
56cfabed234ae51400d9be4b	New_York_City	Which street in NYC today is now named after Juan Rodriguez?	Broadway, from 159th Street to 218th Street	which street in nyc today is now named after juan rodriguez?	broadway, from 159th street to 218th street	broadway, from 159th street to 218th street is
56cedbb9aab44d1400b88b0f	New_York_City	On what island did the Dutch set up a settlement to trade furs?	Governors Island	on what island did the dutch set up a settlement to trade furs?	governors Island	the dutch set up a settlement to trade furs on Governors Island
56cedbb9aab44d1400b88b10	New_York_City	On what island was Fort Amsterdam built?	Manhattan Island	on what island was fort Amsterdam built?	manhattan island	fort Amsterdam was built on Manhattan Island
56cedbb9aab44d1400b88b11	New_York_City	In what year did construction begin on Fort Amsterdam?	1625	in what year did construction begin on Fort Amsterdam?	1625	construction began on Fort Amsterdam in 1625
56cedbb9aab44d1400b88b12	New_York_City	What person bought Manhattan from the Canarsie for the Dutch?	Peter Minuit	what person bought Manhattan from the Canarsie for the Dutch?	peter minuit	peter minuit bought Manhattan from the Canarsie for the Dutch
56cedbb9aab44d1400b88b13	New_York_City	In what year did the Dutch buy Manhattan?	1626	in what year did the Dutch buy Manhattan?	1626	the Dutch bought Manhattan in 1626
56cfb206234ae51400d9be8f	New_York_City	New Netherland established a permanent European presence in what year?	1624	New Netherland established a permanent european presence in what year?	1624	new Netherland established a permanent european presence in 1624
56cfb206234ae51400d9be90	New_York_City	What year did building begin of Fort Amsterdam on Manhattan Island?	1625	what year did building begin of Fort Amsterdam on Manhattan Island?	1625	building began of Fort Amsterdam on Manhattan Island in 1625
56cfb206234ae51400d9be91	New_York_City	What was the myth that Manhattan was bought for by General Peter Minuit ?	glass beads	what was the myth that Manhattan was bought for by General Peter Minuit ?	glass beads	General Peter Minuit bought Manhattan for glass beads
56cedc10aab44d1400b88b19	New_York_City	What did the English call New Amsterdam after its capture?	New York	what did the English call New Amsterdam after its capture?	new York	the English called New Amsterdam after its capture new York
56cedc10aab44d1400b88b1a	New_York_City	What was the regnal name of the Duke of York?	James II	what was the regnal name of the Duke of York?	james II	the duke of york’s regnal name was james II
56cedc10aab44d1400b88b1b	New_York_City	What person gave up New Amsterdam to the English?	Peter Stuyvesant	what person gave up New Amsterdam to the English?	peter stuyvesant	peter stuyvesant gave up New Amsterdam to the English
56cedc10aab44d1400b88b1c	New_York_City	What was Peter Stuyvesant's title?	Director-General	what was peter stuyvesant's title?	Director-General	peter stuyvesant was the Director-General
56cedc10aab44d1400b88b1d	New_York_City	In what year did the English take over New Amsterdam?	1664	in what year did the English take over New Amsterdam?	1664	the English took over New Amsterdam in 1664
56cfb240234ae51400d9be96	New_York_City	Who gave up New Amsterdam to the English without a fight in 1664?	Peter Stuyvesant	who gave up New Amsterdam to the English without a fight in 1664?	peter stuyvesant	peter stuyvesant gave up New Amsterdam to the English without a fight in 1664
56cedc8eaab44d1400b88b23	New_York_City	What was the regnal name of the Prince of Orange?	William III	What was the regnal name of the Prince of Orange?	william III	the regnal name of the Prince of Orange was william III
56cedc8eaab44d1400b88b24	New_York_City	What was the date of Anthonio Colve's capture of New York?	August 24, 1673	what was the date of anthonio colve's capture of new york?	august 24, 1673	anthonio colve's capture of new york occurred on august 24, 1
56cedc8eaab44d1400b88b25	New_York_City	What did Colve call New York after he captured it?	New Orange	what did Colve call New York after he captured it?	New Orange	Colve called New York New Orange
56cedc8eaab44d1400b88b26	New_York_City	In what year did the Dutch give New York back to the English?	1674	in what year did the Dutch give New York back to the English?	1674	the Dutch gave New York back to the English in 1674
56cfb43d234ae51400d9beab	New_York_City	August 24, 1673 is when which Dutch officer  took control of NYC?	Anthonio Colve	august 24, 1673 is when which dutch officer took control of nyc?	anthonio colve	august 24, 1673 is when anthonio colve took control of nyc
56cfb43d234ae51400d9beac	New_York_City	The Dutch gave back the island to which country in 1674 after their trade routes had been destroyed?	England	the Dutch gave back the island to which country in 1674 after their trade routes had been destroyed?	england	the Dutch gave back the island to england in 1674 after their trade route -s had been destroyed
56cfb43d234ae51400d9bead	New_York_City	New York was called New Orange for a period based off which historical figure?	King William III	New York was called New Orange for a period based off which historical figure?	King William III	New York was called New Orange for a period based off King William III
56cedd1caab44d1400b88b41	New_York_City	After what war did the English receive New Amsterdam?	Second Anglo-Dutch War	after what war did the English receive New Amsterdam?	the English received New Amsterdam after the second Anglo-Dutch War	the English received New Amsterdam following the second Anglo-Dutch War
56cedd1caab44d1400b88b42	New_York_City	How many Lenape lived in the area in 1700?	200	how many Lenape lived in the area in 1700?	200	the Lenape population in the area was 200 in 1700
56cedd1caab44d1400b88b43	New_York_City	What was the name of the island the English traded to the Dutch in return for New Amsterdam?	Run	what was the name of the island the English traded to the dutch in return for new Amsterdam?	Run	the island was named Run
56cfb502234ae51400d9beb1	New_York_City	In 1700, the Lenape Native American population had dwindled to how many?	200	in what year were the lenape native american population had dwindled to how many?	200	the lenape native american population had dwindled to 200
56cfb502234ae51400d9beb2	New_York_City	After which war did England gain New York in exchange for Run, an Indonesian island?	Second Anglo-Dutch War	after which war did england gain new york in exchange for run, an indonesian island?	the second Anglo-Dutch War	the second Anglo-Dutch War was the exchange for the island of run
56ceddd9aab44d1400b88b5f	New_York_City	In 1730, what percentage of New York households were slave-holding?	42%	in what year were the five borough -s combined into one city?	1898	the five borough -s were combined into one city in 1898
56ceddd9aab44d1400b88b60	New_York_City	In 1730, what American city had the highest percentage of slaveholders?	Charleston, South Carolina	in what year were the five borough -s combined into one city?	1898	the five borough -s were combined into one city in 1898
56ceddd9aab44d1400b88b61	New_York_City	Near what square was the African Burial Ground unearthed?	Foley Square	near what square was the african burial ground unearthed?	foley square	the african burial ground was unearthed near Foley Square
56ceddd9aab44d1400b88b62	New_York_City	What was being built that resulted in the discovery of the African Burial Ground?	courthouse	what was being built that resulted in the discovery of the african burial ground?	courthouse	the courthouse resulted in the discovery of the african burial ground
56cfb5cb234ae51400d9beb6	New_York_City	Which city in North America held the most slaves in the 1700s?	Charleston, South Carolina	which city in North America held the most slaves in the 1700s?	charleston, south Carolina	charleston, south Carolina was the city in north america that held the most slaves in the 1700
56cfb5cb234ae51400d9beb7	New_York_City	When was as African burial ground discovered after the building of new courthouse?	1990s	when was as African burial ground discovered after the building of new courthouse?	the African burial ground was discovered in the 1990s	the African burial ground was discovered in the 1990s
56cede40aab44d1400b88b71	New_York_City	In what year was John Peter Zenger tried?	1735	in what year was John Peter Zenger tried?	1735	john peter zenger was tried in 1735
56cede40aab44d1400b88b72	New_York_City	On what island did Zenger's trial occur?	Manhattan	on what island did zenger's trial occur?	manhattan	zenger's trial occurred on the island of Manhattan
56cede40aab44d1400b88b73	New_York_City	In what year was Columbia University chartered?	1754	in what year was Columbia University chartered?	1754	Columbia University was chartered in 1754
56cede40aab44d1400b88b74	New_York_City	Under what king did the founding of Columbia University occur?	George II	under what king did the founding of Columbia University occur?	george ii	the founding of Columbia University occurred under king george ii
56cede40aab44d1400b88b75	New_York_City	What was the original name of Columbia University?	King's College	what was the original name of Columbia University?	King’s College	Columbia University was originally named King’s College
56cfb691234ae51400d9bec3	New_York_City	Which trial in Manhatten helped establish the right of freedom of the press?	John Peter Zenger	which trial in Manhatten helped establish the right of freedom of the press?	john peter zenger	the trial involving john peter zenger helped establish the right of freedom of the press
56cfb691234ae51400d9bec4	New_York_City	Columbia University of New York was founded in what year?	1754	Columbia University of New York was founded in what year?	1754	Columbia University of New York was founded in 1754
56cfb691234ae51400d9bec5	New_York_City	The Stamp Act Congress had a meeting in 1765 in which US city?	New York	the Stamp Act Congress had a meeting in 1765 in which us city?	new York	the Stamp Act Congress had a meeting in 1765 in new York
56cedf11aab44d1400b88b93	New_York_City	What was the biggest battle of the American Revolution?	Battle of Long Island	what was the biggest battle of the American Revolution?	battle of long island	the battle of long island was the biggest battle of the American Revolution
56cedf11aab44d1400b88b94	New_York_City	In what borough did the Battle of Long Island occur?	Brooklyn	in what borough did the Battle of Long Island occur?	brooklyn	the Battle of Long Island occurred in the borough of Brooklyn
56cedf11aab44d1400b88b95	New_York_City	In what month and year was the Battle of Long Island fought?	August 1776	in what month and year was the Battle of Long Island fought?	august –1776	the Battle of Long Island was fought in august –1776
