id	title	question	answer	response_question	response_answer	statement
56cf3aa2aab44d1400b88ec2	New_York_City	In what year did the Port of New York and New Jersey deal with unprecedented cargo volume?	2014	in what year did the Port of New York and New Jersey deal with unprecedented cargo volume?	2014	the Port of New York and New Jersey dealt with unprecedented cargo volume in 2014
56cf3aa2aab44d1400b88ec3	New_York_City	In what year was New York ranked first on the Global Economic Power Index?	2012	in what year was New York ranked first on the Global Economic Power Index?	2012	new york was ranked first on the Global Economic Power Index in 2012
56cf4722aab44d1400b88f06	New_York_City	What fraction of New Yorkers in the private sector are employed by foreign companies?	One out of ten	what fraction of New Yorkers in the private sector are employed by foreign companies?	one out of ten	one out of ten New Yorkers in the private sector are employed by foreign companies
56cf4722aab44d1400b88f07	New_York_City	What publication ranked New York first in the 2013 American Cities of the Future rankings?	FDi Magazine	what publication ranked new york first in the 2013 american cities of the future rankings?	fdi magazine	fdi magazine ranked new york first in the 2013 american cities of the future rankings
56cf4837aab44d1400b88f24	New_York_City	What was the 2015 assessed value of all the property in New York?	US$914.8 billion	what was the 2015 assessed value of all the property in New York?	us$914.8 billion	the 2015 assessed value of all the property in new york was us$914.
56cf4837aab44d1400b88f25	New_York_City	How much was Time Warner Center worth in 2006?	US$1.1 billion	how much was Time Warner Center worth in 2006?	us$1.1 billion	the Time Warner Center was worth us$1.1 billion in 2006
56cf4837aab44d1400b88f26	New_York_City	What was the price per square foot of 450 Park Avenue when it sold in July 2007?	$1,589	what was the price per square foot of 450 Park Avenue when it sold in July 2007?	$1,589	450 Park Avenue sold for $1,589 per square foot
56cf4837aab44d1400b88f27	New_York_City	What was the price per square meter of 660 Madison Avenue in June 2007?	$15,887	what was the price per square meter of 660 Madison Avenue in June 2007?	$15,887	the price per square meter of 660 Madison Avenue was $15,88
56cf4837aab44d1400b88f28	New_York_City	Of the top 10 zip codes with the most expensive housing prices in the United States, how many are in Manhattan?	six	of the top 10 zip codes with the most expensive housing prices in the united states, how many are in manhattan?	six	six zip code -s in manhattan have the most expensive housing prices
56cff16a234ae51400d9c128	New_York_City	Which building has the highest market value in NYC?	Time Warner Center	which building has the highest market value in nyc?	Time Warner Center	the Time Warner Center has the highest market value in nyc
56cff16a234ae51400d9c12a	New_York_City	The previous record beaten by Park Avenue was for what real estate?	660 Madison Avenue	the previous record beaten by Park Avenue was for what real estate?	660 Madison Avenue	the previous record was beaten by Park Avenue for 660 Madison Avenue
56cf48a3aab44d1400b88f2e	New_York_City	What is the popular name of New York's advertising industry?	Madison Avenue	what is the popular name of New York’s advertising industry?	madison avenue	new york’s advertising industry is popularly known as madison avenue
56cf48a3aab44d1400b88f2f	New_York_City	About how many people work in the New York fashion industry?	180,000	about how many people work in the new york fashion industry?	180,000	the new york fashion industry employs approximately 180,000 people
56cf48a3aab44d1400b88f30	New_York_City	About how much does it cost per year to pay workers in the New York fashion industry?	$11 billion	about how much does it cost per year to pay workers in the new york fashion industry?	$11 billion	it costs $11 billion per year to pay workers in the new york fashion industry
56cf48a3aab44d1400b88f31	New_York_City	With Interpublic Group, what company has a combined annual revenue of roughly US$21 billion?	Omnicom Group	with Interpublic Group, what company has a combined annual revenue of roughly us$21 billion?	omnicom group	the omnicom group has a combined annual revenue of roughly us$21 billion
56cff1bb234ae51400d9c137	New_York_City	NYC's fashion industry employs how many people?	180,000	nyc's fashion industry employs how many people?	180,000	nyc's fashion industry employs 180,000 people
56cff1bb234ae51400d9c138	New_York_City	The Two highest advertising agencies in the world located in NYC are called what?	Omnicom Group and Interpublic Group	the Two highest advertising agencies in the world located in nyc are called what?	omnicom group and interpublic group	the Two highest advertising agencies in the world located in new york city are called omnicom group and interpublic group
56cf49d7aab44d1400b88f46	New_York_City	How many New Yorkers work in the food processing field?	19,000	how many New Yorkers work in the food processing field?	19,000	nineteen thousand New Yorkers work in the food processing field
56cf49d7aab44d1400b88f47	New_York_City	What is the annual revenue of the food processing industry?	US$5 billion	what is the annual revenue of the food processing industry?	us$5 billion	the food processing industry’s annual revenue is us$5 billion
56cf49d7aab44d1400b88f48	New_York_City	In what borough is the garment business prominent?	Brooklyn	in what borough is the garment business prominent?	brooklyn	the garment business is prominent in Brooklyn
56cf4a29aab44d1400b88f56	New_York_City	What dollar amount of chocolate does New York export annually?	US$234 million	what dollar amount of chocolate does New York export annually?	us$234 million	new york exports us$234 million of chocolate annually
56cf4a29aab44d1400b88f57	New_York_City	Where is the "Chocolate District" located?	Brooklyn	Where is the "Chocolate District" located?	Brooklyn	the "chocolate district" is located in Brooklyn
56cf4a29aab44d1400b88f58	New_York_City	In what borough is Godiva based?	Manhattan	In what borough is Godiva based?	manhattan	godiva is based in the Manhattan borough
56cf4a29aab44d1400b88f59	New_York_City	What is the number one specialty food export of New York?	Chocolate	what is the number one specialty food export of New York?	Chocolate	New York’s number one specialty food export is Chocolate
56cff221234ae51400d9c13f	New_York_City	What type of food is NYC's leading food export?	Chocolate	what type of food is nyc’s leading food export?	chocolate	nyc’s leading food export is chocolate
56cff221234ae51400d9c140	New_York_City	Which one of the world's largest chocolate makers is stationed in Manhattan?	Godiva	Which one of the world's largest chocolate maker -s is stationed in Manhattan?	godiva	the world’s largest chocolate maker is stationed in Manhattan, godiva
56cf4ed5aab44d1400b88fa2	New_York_City	As of 2013, how many people worked for a securities business in New York?	163,400	as of 2013, how many people worked for a securities business in New York?	163,400	one hundred –sixty –three –thousand –four –hundred people worked for a securities business in New
56cf4ed5aab44d1400b88fa3	New_York_City	What percentage of New York private sector jobs are in the securities industry?	5	what percentage of New York private sector jobs are in the securities industry?	5	five percent of New York private sector jobs are in the securities industry
56cf4ed5aab44d1400b88fa4	New_York_City	How much tax revenue does the securities industry generate?	US$3.8 billion	how much tax revenue does the securities industry generate?	us$3.8 billion	the securities industry generates us$3.8 billion in tax revenue
56cf4ed5aab44d1400b88fa5	New_York_City	What is the average income in the New York securities industry?	US$360,700	what is the average income in the New York securities industry?	us$360,700	the average income in the New York securities industry is us$360,700
56cf4ed5aab44d1400b88fa6	New_York_City	What percentage of the city's wages does the securities industry provide?	22	what percentage of the city's wages does the securities industry provide?	22	the securities industry provides 22 percent of the city’s wages
56cff29a234ae51400d9c149	New_York_City	22 Percent of NYC's total wages are from what industry?	The city's securities	22 Percent of NYC's total wages are from what industry?	The city's securities	22 percent of NYC’s total wages are from the city’s securities
56cf5478aab44d1400b88ffc	New_York_City	On what street is the New York Stock Exchange headquartered?	Wall Street	on what street is the new york stock exchange headquartered?	wall street	the new york stock exchange is headquartered on wall street
56cf5478aab44d1400b88ffd	New_York_City	What is the street address of NASDAQ?	165 Broadway	what is the street address of nasdaq?	165 Broadway	the street address of nasdaq is 165 Broadway
56cf5478aab44d1400b88ffe	New_York_City	In 2012, how many investment banking fees were paid out to Wall Street?	$40 billion	in what year were the investment banking fees paid out to wall street?	$40 billion	the investment banking fees were paid out to wall street for $40 billion
56cf5478aab44d1400b88fff	New_York_City	In 2013-4, what percentage of New York state tax revenues came from the securities business on Wall Street?	19%	in 2013-4, what percentage of New York state tax revenues came from the securities business on Wall Street?	19%	the securities business on Wall Street accounted for 19% of New York state tax revenues
56cf5478aab44d1400b89000	New_York_City	Who was the previous overseer of the London interbank offered rate?	British Bankers Association	who was the previous overseer of the london interbank offered rate?	british bankers association	the british bankers association was the previous overseer of the london interbank offered rate
56cff54e234ae51400d9c16a	New_York_City	The New York Stock exchange is located where in NYC?	Wall Street	the New York Stock exchange is located where in nyc?	Wall Street	the New York Stock exchange is located on Wall Street
56cff54e234ae51400d9c16b	New_York_City	The NASDAQ is located on what street in NYC?	165 Broadway	the NASDAQ is located on what street in NYC?	165 Broadway	the NASDAQ is located on 165 Broadway in NYC
56cf552daab44d1400b89022	New_York_City	How many square meters of office space does Manhattan have?	46.5 million	how many square meters of office space does Manhattan have?	46.5 million	Manhattan has 46.5 million square meters of office space
56cf552daab44d1400b89023	New_York_City	About how many million square feet of office space is present in Midtown Manhattan?	400	about how many million square feet of office space is present in Midtown Manhattan?	400	four hundred million square feet of office space is present in Midtown Manhattan
56cff567234ae51400d9c16f	New_York_City	How much office space did Manhatten possess in 2015?	500 million square feet	how much office space did Manhatten possess in 2015?	500 million square feet	Manhatten possessed 500 million square feet of office space in 2015
56cf55aeaab44d1400b89030	New_York_City	In what borough is Silicon Alley located?	Manhattan	in what borough is Silicon Alley located?	manhattan	Silicon Alley is located in the Manhattan borough
56cf55aeaab44d1400b89031	New_York_City	What is the street address of the headquarters of Verizon Communciations?	140 West Street	what is the street address of the headquarters of Verizon Communciations?	140 West Street	the headquarters of Verizon Communciations is located at 140 West Street
56cf55aeaab44d1400b89032	New_York_City	How much did Verizon spend on fiber optic upgrades in New York City?	US$3 billion	how much did Verizon spend on fiber optic upgrades in New York City?	us$3 billion	verizon spent us$3 billion on fiber optic upgrades in New York City
56cf55aeaab44d1400b89033	New_York_City	Approximately how many tech sector jobs are in New York City?	300,000	approximately how many tech sector jobs are in New York City?	300,000	there are 300,000 tech sector jobs in New York City
56cff593234ae51400d9c171	New_York_City	The technology sector of work in NYC has how many employees in its service?	300,000	the technology sector of work in nyc has how many employees in its service?	300,000	the technology sector of work in new york city has 300,000 employees in its service
56cf566aaab44d1400b89042	New_York_City	Along with Cornell University, what institution is involved in the building of Cornell Tech?	Technion-Israel Institute of Technology	along with cornell university, what institution is involved in the building of cornell tech?	the technion-israel institute of technology	along with cornell university, the technion-israel institute of technology is involved in the building of
56cf566aaab44d1400b89043	New_York_City	What is the cost to build Cornell Tech?	US$2 billion	what is the cost to build Cornell Tech?	us$2 billion	Cornell Tech cost us$2 billion to build
56cf566aaab44d1400b89044	New_York_City	On what island is Cornell Tech located?	Roosevelt Island	on what island is Cornell Tech located?	roosevelt island	cornell tech is located on roosevelt island
56cf566aaab44d1400b89045	New_York_City	About how much capital did Accelerator raise as of the middle of 2014?	US$30 million	about how much capital did Accelerator raise as of the middle of 2014?	us$30 million	Accelerator raised us$30 million as of the middle of 2014
56cf566aaab44d1400b89046	New_York_City	How large is the Alexandria Center for Life Science in square meters?	65,000	how large is the alexandria center for life science in square meters?	65,000	the alexandria center for life science is 65,000 square meters large
56cff61d234ae51400d9c17f	New_York_City	In 2011, what school was built on Roosevelt Island?	Cornell Tech	in 2011, what school was built on Roosevelt Island?	cornell Tech	cornell Tech was built on Roosevelt Island
56cf56b2aab44d1400b89056	New_York_City	How many tourists visited New York in 2011?	51 million	how many tourists visited New York in 2011?	51 million	fifty-one million tourists visited New York in 2011
56cf56b2aab44d1400b89057	New_York_City	How many people came to visit New York in 2013?	54 million	how many people came to visit New York in 2013?	54 million	fifty-four million people came to visit New York in 2013
56cf56b2aab44d1400b89058	New_York_City	What is the record number of tourists that have visited New York in a year?	56.4 million	what is the record number of tourists that have visited New York in a year?	56.4 million	the record number of tourists that have visited New York in a year is 56.4 million
56cf56b2aab44d1400b89059	New_York_City	How much money did tourism create for New York in 2014?	US$61.3 billion	how much money did tourism create for New York in 2014?	us$61.3 billion	tourism created us$61.3 billion for New York in 2014
56cff665234ae51400d9c187	New_York_City	How many tourists that visited NYC in 2014 broke the record?	56.4 million	how many tourists that visited nyc in 2014 broke the record?	56.4 million	56.4 million tourists that visited nyc in 2014 broke the record
56cff665234ae51400d9c189	New_York_City	How many tourists visited NYC in 2013?	54 million	how many tourists visited nyc in 2013?	54 million	fifty –four million tourists visited nyc in 2013
56cf571faab44d1400b89069	New_York_City	What English phrase does I ❤ NY represent?	I Love New York	what English phrase does I ❤ NY represent?	i love new york	i ❤ ny represents i love new york
56cf571faab44d1400b8906a	New_York_City	When was I ❤ NY first used in advertisements?	1977	when was i ❤ ny first used in advertisements?	1977	i ❤ ny was first used in advertisements in 1977
56cf571faab44d1400b8906b	New_York_City	Who owns the trademark to I ❤ NY?	New York State Empire State Development	who owns the trademark to i ❤ ny?	new york state empire state development	i ❤ ny is owned by new york state empire state development
56cf571faab44d1400b8906c	New_York_City	What is the state song of New York?	I Love New York	What is the state song of New York?	i love New York	the state song of New York is i love New York
56cff6a7234ae51400d9c18d	New_York_City	I Love New York was established as advertising in what year?	1977	i love new york was established as advertising in what year?	1977	i love new york was established as advertising in 1977
56cff6a7234ae51400d9c18e	New_York_City	What is the state song of New York?	I Love New York	What is the state song of New York?	i love New York	the state song of New York is i love New York
56cf578daab44d1400b89089	New_York_City	In what neighborhood does the Halloween Parade take place?	Greenwich Village	in what neighborhood does the Halloween Parade take place?	greenwich village	the Halloween Parade takes place in Greenwich Village
56cf578daab44d1400b8908a	New_York_City	What company sponsors the Thanksgiving Day parade?	Macy's	What company sponsors the Thanksgiving Day parade?	macy’s	macy’s sponsors the Thanksgiving Day parade
56cf578daab44d1400b8908b	New_York_City	At what location is a Christmas tree famously lit every year?	Rockefeller Center	at what location is a Christmas tree famously lit every year?	Rockefeller Center	a Christmas tree is famously lit every year at Rockefeller Center
56cf578daab44d1400b8908c	New_York_City	Where in Central Park are performances offered at no cost?	Summerstage	where in Central Park are performances offered at no cost?	summerstage	performances are offered at no cost in summerstage
56cf578daab44d1400b8908d	New_York_City	In what borough is the Unisphere located?	Queens	in what borough is the Unisphere located?	queens	the Unisphere is located in the borough of queens
56cf57c2aab44d1400b89093	New_York_City	About how many hotel rooms are there in Manhattan?	90,000	about how many hotel rooms are there in Manhattan?	90,000	there are 90,000 hotel room -s in Manhattan
56cf57c2aab44d1400b89094	New_York_City	What was the percentage increase of Manhattan hotel rooms between 2013 and 2014?	10%	what was the percentage increase of Manhattan hotel rooms between 2013 and 2014?	10%	the percentage increase of Manhattan hotel room -s between 2013 and 2014 was
56cf57c2aab44d1400b89095	New_York_City	Who owns the Waldorf Astoria?	Anbang Insurance Group	who owns the Waldorf Astoria?	anbang insurance group	the Waldorf Astoria is owned by anbang insurance group
56cf57c2aab44d1400b89096	New_York_City	What was the October 2014 purchase price of the Waldorf Astoria?	US$1.95 billion	what was the October 2014 purchase price of the Waldorf Astoria?	us$1.95 billion	the October 2014 purchase price of the Waldorf Astoria was us$1.95 billion
56cff757234ae51400d9c199	New_York_City	The hotel that sold for the most money in 2014 was which in NYC?	Waldorf Astoria New York	the hotel that sold for the most money in 2014 was which in nyc?	waldorf Astoria New York	the hotel that sold for the most money in 2014 was the Waldorf Astoria New York
56cff757234ae51400d9c19a	New_York_City	How many hotel rooms are located in NYC as of the end of 2014?	90,000	how many hotel rooms are located in nyc as of the end of 2014?	90,000	ninety thousand hotel room -s are located in nyc as of the end of 2014
56cff757234ae51400d9c19b	New_York_City	Who bought the Waldorf Astoria hotel in NYC in 2014?	Anbang Insurance Group	who bought the Waldorf Astoria hotel in nyc in 2014?	Anbang Insurance Group	the Anbang Insurance Group bought the Waldorf Astoria hotel in nyc in 2014
56cff757234ae51400d9c19c	New_York_City	The Waldorf Astoria hotel sold for how many dollars?	1.95 billion	the Waldorf Astoria hotel sold for how many dollars?	1.95 billion	the Waldorf Astoria hotel sold for 1.95 billion dollars
56cfac79234ae51400d9be4f	New_York_City	Approximately how many feature films are made in New York City every year?	200	approximately how many feature films are made in New york City every year?	200	approximately 200 feature film -s are made in New york City every year
56cfac79234ae51400d9be50	New_York_City	How many New Yorkers work in the television and film industry?	130,000	how many New Yorkers work in the television and film industry?	130,000	one hundred thirty thousand New Yorkers work in the television and film industry
56cfac79234ae51400d9be51	New_York_City	How much money does the New York film and television industry create every year?	$7.1 billion	how much money does the new york film and television industry create every year?	$7.1 billion	the new york film and television industry creates $7.1 billion every year
56cfac79234ae51400d9be52	New_York_City	What United States city is the second most popular for pilot episode location filming?	Los Angeles	What United States city is the second most popular for pilot episode location filming?	los angeles	the second most popular for pilot episode location filming is los angeles
56cfacff234ae51400d9be57	New_York_City	Along with Warner Music Group, what top three record label is based in New York City?	Sony Music Entertainment	along with Warner Music Group, what top three record label is based in New York City?	sony music entertainment	along with Warner Music Group, sony music entertainment is one of the top three record label -s based in New York City
56cfacff234ae51400d9be58	New_York_City	What city is North America's biggest media market?	New York City	what city is north america’s biggest media market?	new york city	new york city is north america’s biggest media market
56cfacff234ae51400d9be59	New_York_City	Out of the top eight advertising agency networks in the world, how many are based in New York?	Seven	out of the top eight advertising agency network -s in the world, how many are based in New York?	seven	the top eight advertising agency network -s in the world have seven based in New York
56cfad77234ae51400d9be5d	New_York_City	How many people work in the New York publishing industry?	25,000	how many people work in the new york publishing industry?	25,000	twenty-five thousand people work in the new york publishing industry
56cfad77234ae51400d9be5e	New_York_City	Which New York-based newspaper has won the Pulitzer Prize for journalism?	The New York Times	which New York-based newspaper has won the Pulitzer Prize for journalism?	the new York Times	the new york times has won the Pulitzer Prize for journalism
56cfad77234ae51400d9be5f	New_York_City	Along with the New York Times, what national daily newspaper is based in New York?	The Wall Street Journal	along with the new york times, what national daily newspaper is based in new york?	the wall street journal	along with the new york times, the wall street journal is a national daily newspaper based in new york
56cfad77234ae51400d9be60	New_York_City	What was the founding year of the New York Daily News?	1919	what was the founding year of the New York Daily News?	1919	the New York Daily News was founded in 1919
56cfad77234ae51400d9be61	New_York_City	Who was the founder of the New York Post?	Alexander Hamilton	who was the founder of the New York Post?	alexander hamilton	the New York Post was founded by alexander hamilton
56cffb63234ae51400d9c1e5	New_York_City	How many newspaper offices are located in New York?	More than 200	how many newspaper offices are located in New York?	more than 200	there are more than 200 newspaper office -s located in New York
56cffb63234ae51400d9c1e6	New_York_City	How many magazines can call NYC home?	350	how many magazines can call nyc home?	350	there are 350 magazines that can call nyc home
56cffb63234ae51400d9c1e7	New_York_City	How many national newspapers out of the three are from New York?	2	how many national newspapers out of the three are from New York?	2	two national newspaper -s are from New York
56cffb63234ae51400d9c1e8	New_York_City	Which two national newspapers are located in New York?	The Wall Street Journal and The New York Times	which two national newspapers are located in New York?	the wall street journal and the new york times	the wall street journal and the new york times are located in New York
56cffb63234ae51400d9c1e9	New_York_City	When was the New York Daily News founded?	1919	when was the new york daily news founded?	1919	the new york daily news was founded in 1919
56cfafaf234ae51400d9be67	New_York_City	Along with ABC and NBC, what other major broadcaster is based in New York?	CBS	along with abc and nbc, what other major broadcaster is based in new york?	cbs	along with abc and nbc, cbs is a major broadcaster based in new york
56cfafaf234ae51400d9be68	New_York_City	What is the name of the city's public television service?	NYCTV	what is the name of the city's public television service?	nyctv	the city's public television service is nyctv
56cfafaf234ae51400d9be69	New_York_City	What comedy channel on cable television is headquartered in New York?	Comedy Central	what comedy channel on cable television is headquartered in New York?	comedy central	comedy central is headquartered in New York
56cfafaf234ae51400d9be6a	New_York_City	What cable news channel is based in New York?	Fox News	what cable news channel is based in New York?	fox news	fox news is based in New York
56cfb021234ae51400d9be6f	New_York_City	What is the name of the first public-access TV channel in the country?	Manhattan Neighborhood Network	what is the name of the first public-access tv channel in the country?	manhattan neighborhood network	the first public-access tv channel in the country is the Manhattan Neighborhood Network
56cfb021234ae51400d9be70	New_York_City	In what year did the Manhattan Neighborhood Network begin?	1971	in what year did the Manhattan Neighborhood Network begin?	1971	the Manhattan Neighborhood Network began in 1971
56cfb021234ae51400d9be71	New_York_City	What is the primary public television station in New York?	WNET	what is the primary public television station in New York?	wnet	the primary public television station in New York is wnet
